{"$defs":{"capabilityState":{"enum":["unavailable","offline-validated","gpu-validated","failed"]},"completenessState":{"enum":["planned","running","complete","partial","corrupt","failed"]},"contentRef":{"additionalProperties":false,"properties":{"id":{"$ref":"#/$defs/identifier"},"kind":{"$ref":"#/$defs/identifier"},"schema_version":{"const":"1.0.0"},"sha256":{"$ref":"#/$defs/sha256"},"uri":{"minLength":1,"type":"string"}},"required":["schema_version","kind","id","sha256","uri"],"type":"object"},"identifier":{"pattern":"^[a-z0-9][a-z0-9._:-]{2,127}$","type":"string"},"moduleKind":{"enum":["router-logits","router-probabilities","route-selection","routing-weights","shared-expert-output","residual-stream","attention-input","attention-output","attention-summary","mlp-input","mlp-output","expert-input","expert-output","decoder-logits","token-confidence","kv-metadata","quantization-metadata","runtime-metadata","modality-encoder","modality-projection"]},"sha256":{"pattern":"^[0-9a-f]{64}$","type":"string"}},"$id":"https://inkling-small-ampere.invalid/schemas/mechanistic/v1/TelemetryCaptureProfile.schema.json","$schema":"https://json-schema.org/draft/2020-12/schema","additionalProperties":false,"properties":{"campaign_id":{"$ref":"#/$defs/identifier"},"hard_byte_budget":{"minimum":1,"type":"integer"},"id":{"$ref":"#/$defs/identifier"},"kind":{"const":"telemetry-capture-profile"},"max_inflight_bytes":{"minimum":4096,"type":"integer"},"modality_capabilities":{"additionalProperties":false,"properties":{"audio":{"$ref":"#/$defs/capabilityState"},"image":{"$ref":"#/$defs/capabilityState"},"text":{"$ref":"#/$defs/capabilityState"}},"required":["text","image","audio"],"type":"object"},"per_rank_byte_budget":{"minimum":1,"type":"integer"},"probe_ids":{"items":{"$ref":"#/$defs/identifier"},"minItems":1,"type":"array","uniqueItems":true},"public_aggregates_only":{"type":"boolean"},"raw_retention_days":{"maximum":365,"minimum":1,"type":["integer","null"]},"schema_version":{"const":"1.0.0"},"selectors":{"items":{"additionalProperties":false,"properties":{"chunk_bytes":{"maximum":67108864,"minimum":4096,"type":"integer"},"id":{"minLength":1,"type":"string"},"layers":{"items":{"minimum":0,"type":"integer"},"type":"array","uniqueItems":true},"max_capture_tokens":{"minimum":1,"type":"integer"},"max_events":{"minimum":1,"type":"integer"},"max_tensor_elements":{"minimum":1,"type":"integer"},"mode":{"enum":["statistics","tensor"]},"module_kind":{"$ref":"#/$defs/moduleKind"},"sample_denominator":{"minimum":1,"type":"integer"},"sample_numerator":{"minimum":1,"type":"integer"},"token_phases":{"items":{"enum":["prompt","generated","reasoning-observed","final-observed","tool-observed"]},"type":"array","uniqueItems":true},"token_positions":{"items":{"minimum":0,"type":"integer"},"type":"array","uniqueItems":true},"trigger":{"additionalProperties":false,"properties":{"kind":{"enum":["always","phase","token-id","entropy-above","margin-below","route-changed"]},"phase":{"type":"string"},"threshold":{"type":"number"},"token_ids":{"items":{"minimum":0,"type":"integer"},"type":"array"}},"required":["kind"],"type":"object"}},"required":["id","module_kind","mode","layers","token_phases","token_positions","max_capture_tokens","max_events","max_tensor_elements","sample_numerator","sample_denominator","chunk_bytes","trigger"],"type":"object"},"minItems":1,"type":"array"},"sensitivity":{"enum":["public-aggregate","restricted","restricted-model-evidence","restricted-private"]},"tp_world_size":{"minimum":1,"type":"integer"}},"required":["schema_version","kind","id","campaign_id","probe_ids","selectors","hard_byte_budget","per_rank_byte_budget","max_inflight_bytes","tp_world_size","sensitivity","raw_retention_days","public_aggregates_only","modality_capabilities"],"title":"TelemetryCaptureProfile","type":"object"}
