{
  "schema_version": "1.0.0",
  "kind": "telemetry-capture-profile",
  "id": "inkling-mech-production-observation-v1",
  "campaign_id": "inkling-mech-a100-tp4-v1",
  "probe_ids": [
    "retrieval-early-v1",
    "retrieval-late-v1",
    "integration-separated-v1",
    "math-modular-v1",
    "math-modular-paraphrase-v1",
    "science-decay-v1",
    "instruction-conflict-json-v1",
    "instruction-conflict-json-minimal-v1",
    "tool-plan-recovery-v1",
    "effort-short-v1",
    "effort-long-v1",
    "recovery-minimal-failure-v1"
  ],
  "selectors": [
    {
      "id": "runtime-metadata",
      "module_kind": "runtime-metadata",
      "mode": "statistics",
      "layers": [],
      "token_phases": ["prompt"],
      "token_positions": [0],
      "max_capture_tokens": 12,
      "max_events": 12,
      "max_tensor_elements": 128,
      "sample_numerator": 1,
      "sample_denominator": 1,
      "chunk_bytes": 1048576,
      "trigger": {"kind": "always"}
    },
    {
      "id": "quantization-metadata",
      "module_kind": "quantization-metadata",
      "mode": "statistics",
      "layers": [2, 10, 20, 30, 41],
      "token_phases": ["prompt"],
      "token_positions": [0],
      "max_capture_tokens": 60,
      "max_events": 60,
      "max_tensor_elements": 256,
      "sample_numerator": 1,
      "sample_denominator": 1,
      "chunk_bytes": 1048576,
      "trigger": {"kind": "always"}
    },
    {
      "id": "router-logit-statistics",
      "module_kind": "router-logits",
      "mode": "statistics",
      "layers": [2, 10, 20, 30, 41],
      "token_phases": ["prompt", "generated", "reasoning-observed", "final-observed", "tool-observed"],
      "token_positions": [],
      "max_capture_tokens": 4096,
      "max_events": 4096,
      "max_tensor_elements": 258,
      "sample_numerator": 1,
      "sample_denominator": 4,
      "chunk_bytes": 1048576,
      "trigger": {"kind": "always"}
    },
    {
      "id": "route-selection-statistics",
      "module_kind": "route-selection",
      "mode": "statistics",
      "layers": [2, 10, 20, 30, 41],
      "token_phases": ["prompt", "generated", "reasoning-observed", "final-observed", "tool-observed"],
      "token_positions": [],
      "max_capture_tokens": 4096,
      "max_events": 4096,
      "max_tensor_elements": 4,
      "sample_numerator": 1,
      "sample_denominator": 1,
      "chunk_bytes": 1048576,
      "trigger": {"kind": "always"}
    },
    {
      "id": "routing-weight-statistics",
      "module_kind": "routing-weights",
      "mode": "statistics",
      "layers": [2, 10, 20, 30, 41],
      "token_phases": ["prompt", "generated", "reasoning-observed", "final-observed", "tool-observed"],
      "token_positions": [],
      "max_capture_tokens": 4096,
      "max_events": 4096,
      "max_tensor_elements": 4,
      "sample_numerator": 1,
      "sample_denominator": 1,
      "chunk_bytes": 1048576,
      "trigger": {"kind": "always"}
    },
    {
      "id": "shared-expert-contribution",
      "module_kind": "shared-expert-output",
      "mode": "statistics",
      "layers": [2, 10, 20, 30, 41],
      "token_phases": ["prompt", "generated", "reasoning-observed", "final-observed", "tool-observed"],
      "token_positions": [],
      "max_capture_tokens": 2048,
      "max_events": 2048,
      "max_tensor_elements": 4096,
      "sample_numerator": 1,
      "sample_denominator": 4,
      "chunk_bytes": 1048576,
      "trigger": {"kind": "always"}
    },
    {
      "id": "residual-statistics",
      "module_kind": "residual-stream",
      "mode": "statistics",
      "layers": [2, 10, 20, 30, 41],
      "token_phases": ["prompt", "generated", "reasoning-observed", "final-observed", "tool-observed"],
      "token_positions": [],
      "max_capture_tokens": 2048,
      "max_events": 2048,
      "max_tensor_elements": 4096,
      "sample_numerator": 1,
      "sample_denominator": 8,
      "chunk_bytes": 1048576,
      "trigger": {"kind": "always"}
    },
    {
      "id": "attention-output-statistics",
      "module_kind": "attention-output",
      "mode": "statistics",
      "layers": [2, 10, 20, 30, 41],
      "token_phases": ["prompt", "generated", "reasoning-observed", "final-observed", "tool-observed"],
      "token_positions": [],
      "max_capture_tokens": 2048,
      "max_events": 2048,
      "max_tensor_elements": 4096,
      "sample_numerator": 1,
      "sample_denominator": 8,
      "chunk_bytes": 1048576,
      "trigger": {"kind": "always"}
    },
    {
      "id": "token-confidence",
      "module_kind": "token-confidence",
      "mode": "statistics",
      "layers": [],
      "token_phases": ["generated", "reasoning-observed", "final-observed", "tool-observed"],
      "token_positions": [],
      "max_capture_tokens": 1024,
      "max_events": 1024,
      "max_tensor_elements": 32,
      "sample_numerator": 1,
      "sample_denominator": 1,
      "chunk_bytes": 1048576,
      "trigger": {"kind": "always"}
    },
    {
      "id": "kv-context-metadata",
      "module_kind": "kv-metadata",
      "mode": "statistics",
      "layers": [],
      "token_phases": ["prompt", "generated", "reasoning-observed", "final-observed", "tool-observed"],
      "token_positions": [],
      "max_capture_tokens": 1024,
      "max_events": 1024,
      "max_tensor_elements": 64,
      "sample_numerator": 1,
      "sample_denominator": 1,
      "chunk_bytes": 1048576,
      "trigger": {"kind": "always"}
    }
  ],
  "hard_byte_budget": 268435456,
  "per_rank_byte_budget": 67108864,
  "max_inflight_bytes": 1048576,
  "tp_world_size": 4,
  "sensitivity": "restricted-model-evidence",
  "raw_retention_days": 14,
  "public_aggregates_only": false,
  "modality_capabilities": {
    "text": "offline-validated",
    "image": "unavailable",
    "audio": "unavailable"
  }
}
