{
  "schema_version": "1.0.0",
  "kind": "telemetry-capture-profile",
  "id": "inkling-mech-reference-rich-v1",
  "campaign_id": "inkling-mech-a100-tp4-v1",
  "probe_ids": ["math-modular-v1", "math-modular-paraphrase-v1"],
  "selectors": [
    {
      "id": "runtime-metadata",
      "module_kind": "runtime-metadata",
      "mode": "statistics",
      "layers": [],
      "token_phases": ["prompt"],
      "token_positions": [0],
      "max_capture_tokens": 2,
      "max_events": 2,
      "max_tensor_elements": 128,
      "sample_numerator": 1,
      "sample_denominator": 1,
      "chunk_bytes": 4194304,
      "trigger": {"kind": "always"}
    },
    {
      "id": "quantization-metadata",
      "module_kind": "quantization-metadata",
      "mode": "statistics",
      "layers": [2, 10, 20, 30, 41],
      "token_phases": ["prompt"],
      "token_positions": [0],
      "max_capture_tokens": 10,
      "max_events": 10,
      "max_tensor_elements": 256,
      "sample_numerator": 1,
      "sample_denominator": 1,
      "chunk_bytes": 4194304,
      "trigger": {"kind": "always"}
    },
    {
      "id": "router-logits-tensor",
      "module_kind": "router-logits",
      "mode": "tensor",
      "layers": [2, 10, 20, 30, 41],
      "token_phases": ["generated", "reasoning-observed", "final-observed"],
      "token_positions": [],
      "max_capture_tokens": 320,
      "max_events": 320,
      "max_tensor_elements": 258,
      "sample_numerator": 1,
      "sample_denominator": 1,
      "chunk_bytes": 4194304,
      "trigger": {"kind": "always"}
    },
    {
      "id": "route-ids-tensor",
      "module_kind": "route-selection",
      "mode": "tensor",
      "layers": [2, 10, 20, 30, 41],
      "token_phases": ["generated", "reasoning-observed", "final-observed"],
      "token_positions": [],
      "max_capture_tokens": 320,
      "max_events": 320,
      "max_tensor_elements": 4,
      "sample_numerator": 1,
      "sample_denominator": 1,
      "chunk_bytes": 4194304,
      "trigger": {"kind": "always"}
    },
    {
      "id": "routing-weights-tensor",
      "module_kind": "routing-weights",
      "mode": "tensor",
      "layers": [2, 10, 20, 30, 41],
      "token_phases": ["generated", "reasoning-observed", "final-observed"],
      "token_positions": [],
      "max_capture_tokens": 320,
      "max_events": 320,
      "max_tensor_elements": 4,
      "sample_numerator": 1,
      "sample_denominator": 1,
      "chunk_bytes": 4194304,
      "trigger": {"kind": "always"}
    },
    {
      "id": "residual-tensor",
      "module_kind": "residual-stream",
      "mode": "tensor",
      "layers": [2, 10, 20, 30, 41],
      "token_phases": ["generated", "reasoning-observed", "final-observed"],
      "token_positions": [],
      "max_capture_tokens": 640,
      "max_events": 640,
      "max_tensor_elements": 4096,
      "sample_numerator": 1,
      "sample_denominator": 1,
      "chunk_bytes": 4194304,
      "trigger": {"kind": "always"}
    },
    {
      "id": "attention-output-tensor",
      "module_kind": "attention-output",
      "mode": "tensor",
      "layers": [2, 10, 20, 30, 41],
      "token_phases": ["generated", "reasoning-observed", "final-observed"],
      "token_positions": [],
      "max_capture_tokens": 320,
      "max_events": 320,
      "max_tensor_elements": 4096,
      "sample_numerator": 1,
      "sample_denominator": 1,
      "chunk_bytes": 4194304,
      "trigger": {"kind": "always"}
    },
    {
      "id": "routed-expert-output-tensor",
      "module_kind": "expert-output",
      "mode": "tensor",
      "layers": [2, 10, 20, 30, 41],
      "token_phases": ["generated", "reasoning-observed", "final-observed"],
      "token_positions": [],
      "max_capture_tokens": 320,
      "max_events": 320,
      "max_tensor_elements": 4096,
      "sample_numerator": 1,
      "sample_denominator": 1,
      "chunk_bytes": 4194304,
      "trigger": {"kind": "always"}
    },
    {
      "id": "shared-expert-output-tensor",
      "module_kind": "shared-expert-output",
      "mode": "tensor",
      "layers": [2, 10, 20, 30, 41],
      "token_phases": ["generated", "reasoning-observed", "final-observed"],
      "token_positions": [],
      "max_capture_tokens": 320,
      "max_events": 320,
      "max_tensor_elements": 4096,
      "sample_numerator": 1,
      "sample_denominator": 1,
      "chunk_bytes": 4194304,
      "trigger": {"kind": "always"}
    },
    {
      "id": "decoder-distribution-tensor",
      "module_kind": "decoder-logits",
      "mode": "tensor",
      "layers": [],
      "token_phases": ["generated", "reasoning-observed", "final-observed"],
      "token_positions": [],
      "max_capture_tokens": 64,
      "max_events": 64,
      "max_tensor_elements": 201024,
      "sample_numerator": 1,
      "sample_denominator": 1,
      "chunk_bytes": 4194304,
      "trigger": {"kind": "always"}
    },
    {
      "id": "kv-context-metadata",
      "module_kind": "kv-metadata",
      "mode": "statistics",
      "layers": [],
      "token_phases": ["prompt", "generated", "reasoning-observed", "final-observed"],
      "token_positions": [],
      "max_capture_tokens": 128,
      "max_events": 128,
      "max_tensor_elements": 64,
      "sample_numerator": 1,
      "sample_denominator": 1,
      "chunk_bytes": 4194304,
      "trigger": {"kind": "always"}
    }
  ],
  "hard_byte_budget": 2147483648,
  "per_rank_byte_budget": 536870912,
  "max_inflight_bytes": 8388608,
  "tp_world_size": 4,
  "sensitivity": "restricted-private",
  "raw_retention_days": 14,
  "public_aggregates_only": false,
  "modality_capabilities": {
    "text": "offline-validated",
    "image": "unavailable",
    "audio": "unavailable"
  }
}
